definition,academicgoals,describeacademicgoals,resourceswhy,futureimpact
To complete the course of study you chose to invest your time and energy into.,"Getting good grades,Career preparation,Pursuing knowledge/answers,Other","Right now, I aim to get a degree in creative writing, first and foremost.","It's a goal I have arrived for for a long time. I believe I have the necessary tools, direction, and mindset to see it through to the end, successful or not.","I have a couple backup plans in mind, but I won't deny that failure in my main goal pursuit would be a huge bummer."
"It means consistent excellent results starting from A grades, an overall GPA of at least a 3.7 and thriving in extracurricular activities as well.","Getting good grades,Career preparation,Time management,Balancing stress",,"I major in fashion design, so I'm not in a typical liberal arts environment where studying is emphasized for academic success and instead completing projects and showing your creativity/originality is the most important aspect to me. So I feel a different kind of pressure that definitely stresses me out if I don't manage my time very well, but grades won't define what leads to my career in the end. ","If I didn't graduate or complete my BFA in a way that is unsatisfactory to me, it will affect my confidence and self-esteem, which would limit myself from reaching opportunities. Otherwise, academic success doesn't particularly matter in pursuing my dream career. The largest obstacle would be myself. "
"Academic success means that one has excelled in their studies. The acquisition of a degree, getting good grades, or qualifying for the dean's list counts as academic success to me.","Career preparation,Time management,Balancing stress,Grad/professional school preparation,Internships/co-ops,Pursuing knowledge/answers",,"I need a therapist to address my lack of motivation and other mental issues that I have, but my family doesnt take my need for help seriously.","It would affect my ability to get a high paying, consistant job"
,,,,
"Being able to get good grades, regardless of if one learns or not","Getting good grades,Time management",,I think im mostly capable but in some classes I really struggle ,I would have less success career wise
your family not having to struggle.,"Getting good grades,Career preparation,Time management,Balancing stress,Pursuing knowledge/answers",,I have the support system I need.,I wouldn't get into the school I want to.
,,,,
Earning the highest possible grade,Getting good grades,,,
,,,,
,,,,
Having good grades and getting a degree,"Getting good grades,Career preparation,Time management,Balancing stress,Pursuing knowledge/answers",,I have a computer and good library to access good information. I also have professors that will aid in success,"If I had bad grades, I would not get my degree and I would not get a good job"
It means doing my greatest to learn and succeed.,"Career preparation,Time management",,I am doing my best.,I would feel demotivated.
It means getting good grades and passing all my classes,Grad/professional school preparation,,"Lots of school resources, support, and motivation from friends and family",It might make it harder to get into grad school or get good letters of recommendation 
Getting good grades in classes and graduating,"Getting good grades,Career preparation,Pursuing knowledge/answers",,"The job market is the absolute worst right now, so I feel like I need to succeed even more than usual, but the support given is no longer applicable to the current job market.",I wouldn't be able to graduate and get a job in my desired field
"Completing courses, learning, growing and preparing for a career.","Career preparation,Balancing stress,Pursuing knowledge/answers",,"I have a lot of barriers right now.  I'm homeless and have limited access to internet and quiet places to work.  It makes it hard to keep up with classes.  I don't have everything I need to perform at a high level, but I have enough to succeed.",I need this degree to get a higher paying job that will allow me to work part time and still be able to pay my bills. Not being able to complete coursework and finish my degree in a reasonable amount of time will just put me further into debt with nothing to show for it.
Is the achievement of educational goals.,"Getting good grades,Grad/professional school preparation,Pursuing knowledge/answers",,I feel that academic success could change the way I behave and interact with people. It can also open my career paths.,It would not open my career paths.
learning the material and earning a good grade,"Getting good grades,Career preparation,Time management,Pursuing knowledge/answers",,i have the internet and think that is sufficient,"It would make me a less appealiing job candidate, although this currently doesnt matter for me"
Academic success means using the opportunity and knowledge you gained to further advance your career or goals. ,"Career preparation,Time management,Balancing stress,Grad/professional school preparation",,"Even if I have the resources, if I am not right in the mind it is difficult to ask for help in the first place. ",Not having enough experience or connections to get a head start. 
"Being able to be at the top and in control of my test, homework and the school projects.","Getting good grades,Career preparation,Time management,Grad/professional school preparation,Pursuing knowledge/answers",,Like at some point i believe the necessary resources are within my reach but also at the same time they are very far away.,I would think of a career failure which translates to the weaker future or complete change
"Academic success is when a person is able to achieve their academic goals efficiently and effectively. To me, this would entail completing all coursework in a reasonable timeframe, with good grades, and with minimal stress all while being able to balance a life outside of school.","Getting good grades,Career preparation,Balancing stress,Grad/professional school preparation,Pursuing knowledge/answers",,I feel like I have access to most of the resources necessary to succeed but I also feel like it would take more work for me to utilize these resources compared to the average person.,Many of my plans for the future hinge upon me going to professional school and becoming a pharmacist. If I fail to succeed academically now I may not be able to go to professional school which would mean I could not become a pharmacist.
"Getting good grades, and learning things that are applicable to your future career pursuits","Getting good grades,Balancing stress,Grad/professional school preparation,Pursuing knowledge/answers",,Because I have the resources to manage my stress,It might be harder to get into a grad school with a good program
never failing,"Getting good grades,Career preparation,Time management,Balancing stress,Grad/professional school preparation,Pursuing knowledge/answers",,I'm taking lots of classes ,id be homeless
"Academic success means learning the content and doing well (i.e., grades-wise).","Getting good grades,Balancing stress,Grad/professional school preparation,Pursuing knowledge/answers",,,It starts me out with less career/academic confidence.
"This is meaningful growth in understanding, application and progress towards your goals and not just good grades","Time management,Balancing stress,Pursuing knowledge/answers",,I just feel like I am in the right environment for me to succeed,It might affect career opportunities and my confidence.
"Academic success to me is about getting good grades to the best of my ability and most importantly, gaining the knowledge needed to pursue my goals. ","Getting good grades,Career preparation,Time management,Grad/professional school preparation,Pursuing knowledge/answers",,"I feel pressure to succeed academically mainly because academics have always been a part of my identity since I was a child. Being seen by everyone as a gifted kid pressures me to continue succeeding academically due to fear of disappointment, This pressure also serves as motivation to work hard. ",Not being able to succeed in academics would also mean I would not be able to achieve my career goals. 
"Academic success means that I am doing well in classes. Usually, a B or above and that I'm learning and retaining all the useful information. That I'm on track toward graduating soon.","Getting good grades,Career preparation,Time management,Balancing stress,Pursuing knowledge/answers",,Because I can usually talk to someone at school or my friends. They provide the support I need.,"It would prolong my ability to get a good paying job by a few months or a year. Not very much in the long run honestly, but still."
Academic success means learning the material effectively and getting good grades on assignments and exams.,"Getting good grades,Career preparation,Pursuing knowledge/answers",,There are many resources set up by my university and in my personal life that I know I can leverage ,"I would have less opportunities and connections, and probably would have less knowledge"
"Academic success to me isn't necessarily about grades, but about how well you think you understand new topics compared to before taking the class in question.","Getting good grades,Career preparation,Time management,Balancing stress,Extracurriculars/Clubs,Grad/professional school preparation,Pursuing knowledge/answers",,I know I have a variety of resources available to me. The difficulty is having the confidence to ask for them.,"I would not be able to get into law school, which would throw off my entire career trajectory."
Achieving goals ,"Getting good grades,Time management,Balancing stress,Grad/professional school preparation,Internships/co-ops,Pursuing knowledge/answers",,Because my family has my back ,It effects how my outlook his 
"To me, academic success means getting the best grades and graduating with high honors. It means earning a degree and learning instead of memorizing to pass the test.","Getting good grades,Career preparation,Balancing stress,Extracurriculars/Clubs,Grad/professional school preparation",,"Because I've always done it before, but I don't know that I can afford it much longer even on scholarships.","I haven't decided between my original career choice and law school, which would be much more work and money."
I mean getting an education degree.,"Getting good grades,Career preparation,Time management,Balancing stress,Extracurriculars/Clubs,Grad/professional school preparation,Internships/co-ops,Pursuing knowledge/answers",,I have my family and school resources to support me. ,It would be more challenging to get a job.
"Academic success is performing well in your classes, having great test scores, and a great GPA. It can also mean obtaining degrees with a high return on investment, that will get you a good job in the future.","Balancing stress,Grad/professional school preparation",,I feel as though my family really pushes me through and also I do have the financial means in some ways,I think it could prevent me from progressing academically and furthering my education
"Academic success to me is defined as acquiring knowledge and critical thinking skills about the academic objectives outlined in a class syllabus. If it's technical oriented, then having the confidence and knowledge for the degree is important. ","Getting good grades,Career preparation,Pursuing knowledge/answers",,My college has ample tutoring and advisers for academic success ,It would require me to take more classes or seek additional guidance and mentorship 
Great grades & connections,"Getting good grades,Balancing stress,Internships/co-ops",,Well because its the only option I have tbh,
"Doing well in the scholastic world with A’s or B’s, but also having a meaningful impact in the education community around you.","Getting good grades,Career preparation,Time management,Balancing stress",,Because of my husband’s support ,Less opportunities to stand out
"Academic success to me is graduating with what you set out to do, if that’s with high honors that’s your version of it, and if you just want a certificate to get a certain job then that’s your success if you make it there, different for everyone and taking steps back and failing once doesn’t mean you can’t succeed later.","Getting good grades,Career preparation,Balancing stress,Grad/professional school preparation",,"In some ways I feel supported like my mom will help me pay for my tuition and books occasionally and online help for my classes but in other ways I feel like I’m drowning with student loans, the pressure to get a good grade, the fear that I’ll eventually fail after coming so far…all very scary.",If I don’t have academic success and finish my degrees I won’t be able to get a good career and have kids…all I want in the whole world is to have kids and I’m infertile so even if I had a partner I’d have to use IVF to have babies and I need a good salary to even remotely afford that…I can’t fail because the only thing I want in life is a huge expense and I don’t know any other way to get successful.
Being successful with your grades and outlook on your classes going forward. ,"Getting good grades,Time management",,I think this is the correct order of priorities when it comes to your school,The classes that you take are important.
achieving academic goals,"Getting good grades,Career preparation",,because im set,no education no job
"Getting the most out of the time and money put into my college years. Gaining knowledge, skills and relationships to succeed in my career. ","Getting good grades,Career preparation,Time management,Balancing stress,Internships/co-ops,Pursuing knowledge/answers",,"I have grown close with a college professor who is available to me with questions, and I have an advisor who is a certified counselor. ",If I don't do well academically then I won't feel prepared or as though I harbor the knowledge needed to advance in my career. 
Academic success means truly learning and gaining everything I can out of the academic environment that I am in.,"Getting good grades,Time management,Pursuing knowledge/answers",,I know where to go if I need help and I know that I will get it.,I will not have the career or lifestyle that I want to have.
To be successful in schoole,Pursuing knowledge/answers,,,None at all
"Graduating, grasping the class material, and completing the coursework with a B or an A. ",Pursuing knowledge/answers,,the internet is the best resource i could imagine,"disappoint my family, myself"
"Being able to achieve my goals, learn more, and pass successfully. ","Career preparation,Time management,Balancing stress,Pursuing knowledge/answers",,"I have some resources like materials and support but at the same time, I do not have time or money. ",I would have fewer opportunities for a higher-paying job. 
Academic success means to me achieving the goals you set for yourself. It means learning all that you can and being able to apply it in various ways to your life. ,"Getting good grades,Career preparation,Pursuing knowledge/answers",,"Because I'm going back to school at a later time in my life, I understand the importance of why I'm doing it and I definitely take it a lot more seriously than I did the first time I went. ","The future is constantly changing and in my career of choice, my lack of a bachelors degree is really limiting my job opportunities. I don't want to keep making low wages forever and I'd like to advance further. If I flunk out of school, my job opportunities will be much more limited and my wages will continue to be low.  "
"To me, academic success  is about growth, persistence not just getting high grades","Career preparation,Time management,Balancing stress,Pursuing knowledge/answers",,"I feel so because i have instructions, knowledgeable teachers, and tools that make learning easier.",By  limiting certain career options or making it harder to qualify for scholarships or advanced studies
"Not just passing classes, excellence in them to set myself up for the future","Getting good grades,Career preparation,Time management,Balancing stress,Extracurriculars/Clubs,Internships/co-ops,Pursuing knowledge/answers",,Because I have resources available but I’m still struggling so much,If I don’t get good grades I can’t go to law school then all of my studies are meaningless 
It means learning the subject matter thoroughly enough to demonstrate a capable understanding of it. ,"Getting good grades,Career preparation,Time management,Extracurriculars/Clubs,Grad/professional school preparation,Internships/co-ops,Pursuing knowledge/answers",,I feel that I do too much on my own and do not all for enough help. ,I will not abusive the degrees I want and this can lead to not getting the career opportunities I want. 
"Academic success, to me, means that I have absorbed the information I am being taught and that I am putting that information to great use. This can mean many things; maintaining a good grade, getting into an internship relevant to my degree, working towards scholarships, etc.","Getting good grades,Career preparation,Balancing stress,Extracurriculars/Clubs,Internships/co-ops,Pursuing knowledge/answers",,,"I would not be able to find work within my locale that would sustain my family and future goals. I would feel personally unfulfilled, as the work I wish to do requires an education. I would be indebted beyond reasonable means."
"Academic success to me doesn't just mean having a high GPA and getting a degree, but it also means getting a large return on investment from your education, and being able to land a high income, stable job as a result of your educational success.","Getting good grades,Career preparation,Time management",,Having a large support network means that I have a lot of people to fall back on whenever I get super stressed out or overwhelmed by education and / or work. This means I have numerous contingency plans if things end up not working out (which they tend to not.),"I think it would reduce my future economic and retirement prospects definitely, especially given how extremely competitive the highest paying jobs are (which are mainly in the tech field, where my degree is focused in). I want to land a high paying job as soon as possible so that I can save up and invest enough that I eventually don't ever have to work again. That's my ultimate goal for the future."
Achieving good grades and gaining knowledge,"Getting good grades,Career preparation,Pursuing knowledge/answers",,"It's just a burden to constantly carry that eventually gets tiring, like holding a glass of water for weeks without putting it down.","Getting a job right out of college if you have little to no experience or applying to graduate school, since they all look at your GPA."
Academic success is attaining the knowledge and goals that you wish to get from education.,"Getting good grades,Career preparation,Pursuing knowledge/answers",,"My university has many options for me if I need help. There is tutoring, the library, therapy, and many more.,","If I did poorly in a class, I probably did not understand the material well, which would make me less prepared for a career."
Academic sucess is being able to not only pass your classes but also being able to build yourself up. like getting connections for the future and having a plan that can be bent or reshaped as needed. ,"Getting good grades,Time management,Balancing stress,Pursuing knowledge/answers",,"It feels like as time goes by there's less and less doors open. Everytime I reach a goal, ten more doors shut close. Everytime I fail a goal, triple that amount shut close, and with an even more heart breaking noise. Society expects people to graduate in a certain time and I'm stuck being compared to others I know. It doesn't end, it's a repeating cycle of stress and motivation to keep going, each fighting with one another to push me ahead or pull me back.","There are people who have expectations for me, and the goals I've for myself. I've spoken too much about my goals that people expect me to fulfil them as I said. I wouldn't be happy in the future dealing with this and I fear my failures would leave a permanent mark that others could see in the future."
Completing coursework and increasing ones knowledge,"Getting good grades,Career preparation,Balancing stress",,lacking personal motivation,less prospects
"Most importantly, it means being able to fully grasp and understand concepts within the field of study I'm in. In addition, it's the question of ""am I able to use this knowledge to further fuel my passion for this field and find ways to improve the current state of our world?""","Career preparation,Time management,Extracurriculars/Clubs",,"I come from a complex family dynamic where it feels like one parent is very encouraging and helpful in helping me navigate my academic journey and post-grad career while my other parent acts more out of self-interest when it comes to advising me on how to navigate my future and consequently, adds to a lot of the stress I feel in my academic journey. I'm at a point in my life where my desire to succeed academically moreso stems from my desire to get a career and be able to leave my home life as I don't feel my personal family situation contributed positively to my academic journey.","I fear that if I didn't succeed academically it would therefore limit my career opportunities and consequently, take longer for me to achieve financial independence and be able to remove myself from my home life."
It means getting good grades and retaining the information you learn in school. Succeeding in completing your academic classes and getting a degree.,"Getting good grades,Balancing stress,Pursuing knowledge/answers",,"I feel like I have the tools I need, but it would be easier if I had  more support with stuff around the house/my child while trying to do school work and working full time","If I'm unable to get a degree, it will prevent me getting more opportunities to advance within my career. I think my grades probably matter less than me actually getting a degree, but I'm hard on myself, and can't stand getting lower than an A"
understanding what I learn,Pursuing knowledge/answers,,I feel like I need more that what I already have,my career really depends on my academics
Getting good grades and learning the information you need to know,"Getting good grades,Career preparation",,The resources are available but they're not easily accessible. Like the tutoring that's available is kind of set it up on your own it's kinda of difficult to get started.,if I fail completely I won't get a college degree and i'll be poor.
It means learning and retaining information at a high level.,"Career preparation,Balancing stress,Pursuing knowledge/answers",,I have a great support team available for me.,Lesser paying work.
Doing well in school,"Getting good grades,Balancing stress,Pursuing knowledge/answers",,My school has a lot of places I can seek help in,I would end up with a worse paying job after graduation.
Academic success to me means that I am making good grades and staying focused.,"Getting good grades,Career preparation,Time management,Balancing stress,Pursuing knowledge/answers",,"Sometimes I feel like my family doesn't want me to succeed, and sometimes school gets hard.",It would stop me from getting my career to where it wants to be.
Academic success means getting high grades with good morale that follows.,"Getting good grades,Time management,Pursuing knowledge/answers",,"Because I know that with a passion to succeed,  I will be able to",Less opportunities
"Get A or B for every class
that I am taking, graduate with a 3.5 or higher GPA.","Getting good grades,Time management,Balancing stress,Extracurriculars/Clubs,Grad/professional school preparation,Pursuing knowledge/answers",,"All of my family members have a successful career, my parent wants me to be like them.",I’m planning to become a registered nurse so I must do well in every class to get into the nursing program.
Academic success to me means being able to pass your classes with a good understanding of the material. ,"Balancing stress,Internships/co-ops",,I tend to get stressed about school and I don't have the best coping mechanisms for that,I currently am not eligible for certain jobs due to my GPA and have a harder time getting jobs because my lack of internships.
Having good grades and being well versed in your subject matter,"Getting good grades,Time management,Balancing stress,Grad/professional school preparation,Pursuing knowledge/answers",,I feel as if I am encouraged by those around me in a beneficial manner,It would make getting into further education more difficult
,,,,
,,,,
achieving good grades and learning information,"Career preparation,Extracurriculars/Clubs",,because i do not have it all and i still had something ,because i would not have been successful
Obtaining good grades,"Getting good grades,Time management,Internships/co-ops",,I feel like there are not many good resources so I just have to use the internet to learn,I feel like academic success is an indicator to how well you will do in life. 
Graduating with a high gpa,"Career preparation,Grad/professional school preparation,Pursuing knowledge/answers",,,
Academic success means earning a degree.,"Career preparation,Time management,Balancing stress,Internships/co-ops",,I want to do better than my parents,I would have self-doubt and be unmotivated
To me academic success means doing the best I can to get the best grades I can and get a job in my chosen field.,Career preparation,,,If I didn't succeed academically I would not be able to get a well paying job to get out of the hole I'm  in.
