definition,academicgoals,describeacademicgoals,resourceswhy,futureimpact
"Getting average to above-average grades, working hard on learning, and setting future goals for after graduation.","Getting good grades,Career preparation,Internships/co-ops",,I have many on-campus resources to help me if I need extra advice or someone to help me understand a project or assignment better.,"If my work is not up to standard for school, then it would not be up to standard for employers, and I would have a harder time getting internships/jobs."
Academic success mean graduating college with a degree and a decent GPA.,"Career preparation,Time management,Pursuing knowledge/answers",,I beleieve have the respurces I need to achieve success because I am currently pursuing my second bachelor's degree so I know where and who to reach out to if help is needed.,I most likely wouldn't be able to land the job/career I want without the degree.
it means getting good gradea,"Getting good grades,Career preparation,Extracurriculars/Clubs,Grad/professional school preparation,Internships/co-ops",,i feel like a failure sometimes,i wouldn't get into PA school
"Academic success just means succeeding academically, such as getting good grades, getting a degree, or receiving academic awards.","Getting good grades,Career preparation",,"I have resources available, such as financial aid and other campus resources like libraries, but the emotional support from my family mostly causes more pressure for me.",This would affect my ability to get a job that suits my needs.
being successful in what works best for you and not others.,"Career preparation,Balancing stress,Extracurriculars/Clubs",,,A lot of jobs I am applying for want this realistic GPA that I don't have so I am limited.
"Academic Success to me is just about the grades in my opinion. MY standard of success is just ""passing grades"" so C's and up. As long as you are on track to graduate, you are successful. ",Getting good grades,,"I have education coaches, and counselors that offer me resources to succeed.","I'm already in my career, if I get a degree it will just give me an opportunity to change my career. So school isn't really going to mean that my life style will deteriorate if I fail. And if I succeed there's no telling whether or not it will change my life.  "
"getting good grades, progressing through school years, and understanding the material.","Getting good grades,Career preparation,Balancing stress,Internships/co-ops,Pursuing knowledge/answers",,"Class is tough, college is extremely difficult and stressful (especially for an engineer),  so if I don't do well, i feel like i let myself down.","i likely wouldnt be able to get a job in my field, and would be much harder to make a comfortable living after all of my student loan debt"
"Maintaining good grades and a high GPA, and completing my degree programs. ",Getting good grades,,"I have scholarships and award money to pay for school, so I only have to worry about succeeding in my classes and obtaining my degrees. ","My job prospects would be very limited, and I would likely make way less money in my career compared to if I was successful in school. "
graduating SCHOOL,Other,Get through  school and get my degree,It is just how i am,My knowledge in my degree
Building skills and opportunities for my future,"Getting good grades,Balancing stress,Grad/professional school preparation",,I have a lot of things going on in my life and I feel like I have sufficient opportunities and people I can rely on,I would be behind in my goals
Receiving a degree,"Getting good grades,Career preparation,Balancing stress,Grad/professional school preparation,Pursuing knowledge/answers",,,I wouldn't graduate can't pay back loans without a degree
Showing immense growth in education and progressing to the fullest extent possible.,"Time management,Balancing stress,Pursuing knowledge/answers",,I have family and friends all of which have the mutual feeling.,Getting a job and making proper income would be horrendous. 
Being successful and passing all my academics and graduating with a degree.,"Getting good grades,Career preparation,Time management,Balancing stress,Internships/co-ops,Pursuing knowledge/answers",,"I feel this way because yes there are a lot of support to help me achieve my goals, but since we have a bigger cohort, I feel like that support is thin in the way where there are more students to faculty and I may not be able to receive the support I need all the time.",It would delay graduation and I would be much older than I wanted to be in school for.
"Being able to apply classroom studies in real life scenarios, for instance math helping during purchase calculations. ",Grad/professional school preparation,,"Having my school fees paid, getting necessary school materials like books bought.",Not getting career job thus not being able to achieve my goals in life.
It means finding  job that my academic learning has helped and led me to.,"Career preparation,Pursuing knowledge/answers",,I think it all costs so much money. I do believe I can do it though.,You have to do well academically to afford any kind of future.
"Two interpretations of it, one is the ability to get good grades, know what your teachers want from you and do that. Secondly, is to actually learn the material and gain value from your courses. The second one is more important to me, but I think most people would assume the first. ","Getting good grades,Time management,Pursuing knowledge/answers",,"I haven't run into a problem that I couldn't overcome yet, and I still have more resources I haven't used (like free tutoring, study partners, etc).","I would be starting my life out on a bad note. Sort of like how when you start your day off wrong, the whole day is off, do you want this for your life?"
Success means passing my classes but also learning new things about myself and what subjects interest me.,"Getting good grades,Pursuing knowledge/answers",,I have resources but I often find myself too anxious to use them,"As long as I at least pass my classes I think that a degree in anything is helpful for the future, I don't have to be the best student."
"It means putting in your best effort and getting good grades. Bs and As are the best, but it depends on effort.","Getting good grades,Career preparation,Time management,Balancing stress,Internships/co-ops,Pursuing knowledge/answers",,I can study and get office hours. Some times the professor is bad but all and all I should be able to achieve good grades. It just takes a lot of effort in my major.,"I would probably end up in a less impact full position. Also in my job I would get paid less, I might struggle to find a job too."
Getting grades that allow me access to my next level of education or professional career and learning.,"Career preparation,Time management,Pursuing knowledge/answers",,I have struggled with motivation in the past,It would make opportunities in competitive areas more difficult
Actively retaining information,Time management,,,
It means doing well in school but I can still balamce school life and enjoy life in general. ,"Getting good grades,Career preparation,Time management,Balancing stress,Grad/professional school preparation",,Because I feel like I do have the support but I don't know exactly where to find it.,I think it will affect me because right now because people want to see where I was and how I handled stress. 
"A 3.5+ gpa, and actually understanding the material and being able to apply it.","Getting good grades,Career preparation,Time management,Extracurriculars/Clubs,Internships/co-ops",,My family and those around me are giving me great support.,In engineering specifically high academic achievement is a big plus.
Retaining the material and being able to use it correctly,"Getting good grades,Internships/co-ops",,The materials provided from the university are very useful,I would not have learned anything
It means that I actually complete a degree program and get as close to a 4.0 GPA as possible. It also means that I earn the respect of my teachers so they feel confident in recommending me for a job after graduation.,"Getting good grades,Career preparation,Grad/professional school preparation,Pursuing knowledge/answers",,"I have a disability, and need certain accommodations that I have not gotten at the current college. I withdrew for a semester because one teacher would not give me that accommodation.",I don't need to work or get a second degree--I am retired. My house is owned outright...so my future is stable regardless of whether I am successful in finishing this degree.
,,,,
"Academic success means the showing of excelling academically, whether it be through getting high marks or even being part of academic programs only available to those of a particular aptitude/performance ","Getting good grades,Career preparation,Time management,Balancing stress,Internships/co-ops",,"I think I'm progressing from an atypical point compared to the average student, in that I'm pursuing my degree after completing a different program in hopes of getting a more sustainable and productive career out of it. Due to this, I think I'm on the backfoot in terms of progress but I have *some* means of attaining my goals","I think with the career path I've chosen to pursue now, it relies heavily on the capability to make good use of skills I would have sharpened if I had done well academically"
Graduating with a satisfactory grade and learning the materials,"Getting good grades,Career preparation,Time management,Balancing stress,Grad/professional school preparation,Internships/co-ops,Pursuing knowledge/answers",,"It feels so difficult and helpless, but I am getting through it day by day.","Harder to make a satisfactory amount of money, harder to find jobs, harder to maintain relationships with people, a lot of self blame"
good scores,Getting good grades,,because im uncertain,this would put my future at risk
To be organized and try your hardest in studies.,"Getting good grades,Career preparation,Time management",,,Career choice
"I think academic success means gaining knowledge and skills that you can apply into your real life (real-life scenarios). Also, showing a level of dedication and persistence to obtain good study habits and not just trying to ""get things done"" is very beneficial to your long-term goals as well.","Career preparation,Internships/co-ops,Pursuing knowledge/answers",,"There's a ton of things I want to accomplish for my family, and of course, for myself, but I feel as though time is running out. You see these people around you and mainly on social media who've accomplished great things before or at your age, and makes you feel stresssed and like you need to do more. It's easy to feel discouraged but in a way, it motivates me to try harder to get where I want to be.","I currently am unemployed, so if I didn't do well academically I'd be in the same spot for essentially the rest of my life (unless I got married/came into money, etc). This would put me into a very bad spot mentally and financially; not being able to move out, not having my own things, not having certain life experiences, etc. I'd say I'm a pretty independent person (as much as I can be given my current situation), so if I wasn't able to achieve these things, I'd imagine I'd be pretty depressed/even more stressed."
Success in academics,"Getting good grades,Career preparation,Time management,Extracurriculars/Clubs,Pursuing knowledge/answers",,Bitch idk?,I wouldn't graduate? Why are we asking stupid questions 
It means getting good grades and learning the material for the future.,"Getting good grades,Career preparation,Time management,Pursuing knowledge/answers",,I have the ability to learn by using technology or resources from my college.,I would not be able to graduate and get a degree. I would not know how to perform during my career.
Academic success means that you are able to exceed your goals in an academic setting and being able to apply them for something useful/valuable (a top school/internship/job or something that is high-paying),"Getting good grades,Career preparation,Time management,Balancing stress,Extracurriculars/Clubs,Internships/co-ops,Pursuing knowledge/answers",,"My school is big and has a lot of people that have made it into big companies or have gained wealth. However, it is not a target school for a lot of industries, so it is really hard to break into certain industries (high finance, quant, etc.)",I would lose my scholarship and then would have to spend all of my effort into regaining my grades so I can afford to go to school.
"Academic success means doing well academically, which to me means actually understanding the subject matter","Getting good grades,Career preparation,Extracurriculars/Clubs,Grad/professional school preparation,Internships/co-ops",,I feel completely capable of achieving my academic goals,It would at the very least be significantly harder to achieve my career goals
It means getting excellent grades and continuing to move forward in my education,"Getting good grades,Time management,Grad/professional school preparation,Pursuing knowledge/answers",,,I think if I do not succeed academically at my age then I have some really hard life lessons still to learn. It would mean I have failed myself
Having great grades to pass classes on time.,"Getting good grades,Balancing stress",,Because ive always had someone in my corner when it comes to these things.,I would just have to try other ways to make it through the world no biggy.
Getting the most out of my classes,"Getting good grades,Career preparation,Grad/professional school preparation,Internships/co-ops",,There are many resources at school,How I'm seen by professors
"Getting straight A's while maintaining a good school and life balance. It's all about making sure I stay healthy and concentrate on my work, while making sure to not overdue it.","Getting good grades,Balancing stress,Internships/co-ops",,"I have no genuine support system, but I feel as If I can handle it.","I'm working towards becoming an Illustrator, regardless of status I still am an artist."
Academic success to me means getting good grades in your classes and understanding the material that is being taught.,"Getting good grades,Pursuing knowledge/answers",,"I feel this way because I can talk to my professors and they give me encouragement to pursue my academic goals, I also have family members to talk to when I have a problem and they give me a gentle push to achieve my academic goals.","If I don't do well academically, I do not have the safety net good academics provide so it would be much difficult to get the job that tailored to my major, thus, affecting my potential income."
"Performing highly in classes, getting and keeping scholarships and graduating with honors. ",Other,Supporting my children in their school. ,I have already had academic success. ,I have already achieved academic success so further education would just be for fun. 
Academic success means having the most rewarding and complete school career for yourself as a student is all facets of the term.,"Getting good grades,Career preparation,Balancing stress,Grad/professional school preparation,Pursuing knowledge/answers",,"I have a great support system behind me, and many close friends and family members who are willing to do whatever it takes to help.","It would have nothing but negative effects for my future, as I would not be prepared to pursue my career and goals."
Doing well in academics,Pursuing knowledge/answers,,I think I am set up with the right resources to succeed,I would have a lower paying job 
Academic success means to achieve a true understanding of the academic material and goods grades that reflect the understanding.,"Getting good grades,Time management,Balancing stress",,"I feel as if there are many resources to achieve academic success, but it mainly depends on yourself.",If I cannot pass my classes than I lose my financial aid therefore losing my means to attend school. 
it means excelling in the courses you take and getting grades you push yourself to get like As. It also means actually learning things that will be useful in your career. ,"Getting good grades,Career preparation,Extracurriculars/Clubs,Internships/co-ops",,Because I tend to think of myself as a perfectionist. ,I wouldn't have the skills to get an internship
Academic success means doing well in school and trying your best in classes and assignments.,"Getting good grades,Career preparation,Grad/professional school preparation,Pursuing knowledge/answers",,"I feel very well supported by my family, school, and peers.",I think it would be harder to get into graduate schools and land a job after graduation.
Understanding class material and getting high grades,"Career preparation,Balancing stress,Pursuing knowledge/answers",,I feel like I can succeed in my classes without much outside help,"I may need to retake classes, which would extend the amount of time I spent out of the workforce"
Learning the material and retaining the information to apply to real world work scenarios that benefit both the business and consumer.,"Getting good grades,Career preparation,Time management,Balancing stress,Pursuing knowledge/answers",,"My school makes me feel completely supported in my academics.  Teachers open encourage students to sit in on video lectures, they are open and transparent with their office hours too","My concentration is in contracts and acquisitions. And my career goals are pursuing a job in the government. Sector for procuring contracts for the government, not doing well. In school would not help me get to that position. Because everything I'm learning in school is where world experience on government contracting acquisitions. Submitting bids, and it's a direct correlation."
Working hard to learn more,"Getting good grades,Career preparation,Time management,Balancing stress,Extracurriculars/Clubs,Grad/professional school preparation,Internships/co-ops,Pursuing knowledge/answers,Other",Graduating ,I get overwhelmed ,Less career options 
excelling not only in exam but being able to apply the learning.,"Getting good grades,Career preparation,Grad/professional school preparation,Pursuing knowledge/answers",,,
Getting an education and successfully applying what you’re going to school for or studying to your life,"Career preparation,Internships/co-ops,Pursuing knowledge/answers",,Everything is put in front of me,I wouldn’t have the same amount of knowledge and experience 
Academic success means excelling in all of your classes while maintaining a nice school life balance.,"Getting good grades,Career preparation,Time management,Grad/professional school preparation",,I know I have people to talk about my problems if I needed it.,"I am already a 5th year while all of my friends have real jobs, so I would be put behind a little farther."
Academic success means truly assimilating the information I am learning and putting forth 100% effort at all times. ,"Getting good grades,Balancing stress,Pursuing knowledge/answers",,"We are in an age where we have access to unlimited resources. It is not always easy to  achieve all of my objectives as I work full-time and have a family as well. However, it is absolutely possible with enough perseverance and taking advantage of all of the resources out there that can help. ",My career goals require that I perform at the top level academically. 
Getting good grades,"Getting good grades,Career preparation,Time management,Balancing stress,Pursuing knowledge/answers",,Severe amounts of pressure,I wouldn't be able to continue to afford college
"It means striving for more, to learn why in school and to do well, get good grades. Typically after going to high school.","Getting good grades,Career preparation,Time management,Balancing stress,Pursuing knowledge/answers",,I feel like there could be more offered by my college. They don't have enough councilors to see everyone as needed. It is hard to get appointments. As for professors they are always busy. I feel like a lot of it comes down to me. ,I am trying to get a degree that will open up more doors for me in careers. I'm hoping that it will help me.
Performing well in higher education,"Getting good grades,Internships/co-ops,Pursuing knowledge/answers",,I feel very fortunate to be comfortable and academically successful in my online schooling. ,I feel that it would effect my career opportunities if I did not have access to the education I do now.
doing well in school,Career preparation,,i have the support i need from my family,cant get a good job
Deans list,"Getting good grades,Extracurriculars/Clubs,Internships/co-ops",,Its hard to really gauge how successful i will be.,no law school
Absorbing the content corexrlu,Career preparation,,I feel like academic success drives how successful your job will be,Poor school performance would lead to poor job performance
The ability to learn and apply new knowledge to real world situations in an educational environment ,"Getting good grades,Career preparation,Time management,Balancing stress,Internships/co-ops,Pursuing knowledge/answers",,"I have the tools to complete the schooling, but lack guidance on how to apply them",The career field I am entering does not put as much weight to the degree as they do experience and inowledge
,,,,
Academic success means both scoring well enough by your schools metric to reach your future goals (ex applying to medical schools) and more importantly learning the material thoroughly in a wha that promotes longevity ,"Getting good grades,Career preparation,Time management,Balancing stress,Extracurriculars/Clubs,Grad/professional school preparation,Internships/co-ops,Pursuing knowledge/answers",,My school has great academic support and I have many friends and peers that are learning the same things I am and have different strengths ,It would affect my applications to internships and grad schools 
"Scoring well in exams and coursework, comprehending and gaining new knowledge, broadening perspectives and understanding, and becoming a citizen of the world. ","Getting good grades,Career preparation,Internships/co-ops,Pursuing knowledge/answers",,"My family is supportive of my life goals, but also set boundaries and clear expectations of what is expected of me. ","It affects my motivation, self-esteem, and confidence. I do not want to disappoint my family or loved ones, as well. "
"Academic success means being successful in your program, whether it be undergrad, postgrad, etc. Passing your degree program, not just barely making it, and actually learning something from it. ","Career preparation,Internships/co-ops,Pursuing knowledge/answers",,"I feel like many universities, friends, family, always have many different ways of providing help or resources to you in order for you to succeed and achieve academic success. Of course, each have their own way of providing it, but there is always something out there to help you. ","I wouldn't be able to finish my degree program, I would have much less of a chance to obtain a career in the field I am seeking, and would then owe a ton of money with nothing to show for it. "
Reaching the desired academic levels throughout one's life.,"Grad/professional school preparation,Internships/co-ops,Pursuing knowledge/answers",,I have the right support system around me.,It is academic succes that made me meetmost of my social network which have proven to be important.
completing college,"Getting good grades,Time management,Balancing stress,Pursuing knowledge/answers",,"My husband, family, friends and work support my goals",No finishing my goals will not allow me to move on to another career
Striving for excellence in the school setting even if not achieving it.,"Getting good grades,Time management,Balancing stress,Extracurriculars/Clubs,Pursuing knowledge/answers",,Everything I need to be successful academically can be found online,I would be unable to get the higher up jobs that I want.
being smart and having high grades ,Getting good grades,,Family supports me ,I would get unmotivated
"Academic success means getting the degree and graduating with a good GPA. But, it also means getting that real life experience in between as well.","Career preparation,Extracurriculars/Clubs,Internships/co-ops",,"I feel this way because it's always been my goal to get a degree, get a good job and make good money. But, I feel as if it is also society pressures to be successful.",It would effect my future because what if I want to go to graduate school in the future? My grades would effect that.
"It means graduating on time, having good grades while having a decent academic-work-life balance.","Getting good grades,Career preparation,Time management,Balancing stress,Internships/co-ops,Pursuing knowledge/answers",,"Being a mostly independent student who has not had the best guidance in life during high school and my early adulthood has given me challenges that others don't have, these are not as easy to deal with as opposed to students who where given full support from their parents through their entire academic career and where given proper guidance about what to do.

I feel like I have unknowingly wasted a lot of time when I started school and that is not time I will get back and there is no undoing what has already been lost, only managing what I have left better. Taking care of myself isn't something I can sacrifice on either, but now that I am an adult. I need to work, take care of my health, pursue life goals that go beyond academics and career, and this isn't easy either. But does limit how much I can commit to academics within a day.","Not much at this point, just the date I graduate and start professional work."
